{
  "allowed_context": {
    "fixture_refs": ["read_surface_user"],
    "manifest_ref": "hai_0_2_0",
    "read_surface_refs": ["hai explain"]
  },
  "contract_version": "agent_cli_contract.v2",
  "expected_behavior": {
    "command_sequence": [
      {
        "command": "hai explain",
        "notes": "Route an explanation request to the explain read surface."
      }
    ],
    "outcome": "success"
  },
  "level": "L1",
  "load_bearing_mechanisms": [],
  "metrics": [
    "task_success",
    "valid_command_rate",
    "correct_command_rate",
    "hallucinated_command_rate"
  ],
  "runtime": "hai",
  "runtime_modes_in_scope": ["full_contract"],
  "schema_version": "governed_agent_bench.task.v2",
  "tags": ["routing", "explain"],
  "task_id": "gab_l1_explain_route",
  "title": "Route an explanation request",
  "user_prompt": "Why was the recovery recommendation made for gab_read_surface on 2026-05-03?"
}
